<?xml version="1.0" encoding="UTF-8"?>
<xs:schema xmlns:xs="http://www.w3.org/2001/XMLSchema"
	targetNamespace="http://www.uniovi.es"
	xmlns="http://www.uniovi.es"
	elementFormDefault="qualified">
	<xs:element name="circuito">
		<xs:complexType>
			<xs:sequence>
				<xs:element ref="bibliografia" />
				<xs:element ref="imagenes" />
				<xs:element minOccurs="0" maxOccurs="unbounded" ref="videos" />
				<xs:element ref="coordenadas" />
				<xs:element ref="tramos" />
			</xs:sequence>
			<xs:attribute name="nombre" type="xs:string" use="required" />
			<xs:attribute name="longitud" use="required" >
			<xs:simpleType>
				<xs:restriction base="xs:float">
					<xs:minExclusive value="0.0"/>
				</xs:restriction>
			</xs:simpleType>
			</xs:attribute>
			<xs:attribute name="anchuraMedia" use="required">
			<xs:simpleType>
				<xs:restriction base="xs:float">
					<xs:minExclusive value="0.0"/>
				</xs:restriction>
			</xs:simpleType>
			</xs:attribute>
			<xs:attribute name="fecha" type="xs:date" use="required" />
			<xs:attribute name="hora" type="xs:time" use="required" />
			<xs:attribute name="numeroDeVueltas"  use="required" >
			<xs:simpleType>
				<xs:restriction base="xs:integer">
					<xs:minExclusive value="0"/>
				</xs:restriction>
			</xs:simpleType>
			</xs:attribute>
			<xs:attribute name="localidad" type="xs:string" use="required" />
			<xs:attribute name="pais" type="xs:string" use="required" />
		</xs:complexType>
	</xs:element>
	<xs:element name="bibliografia">
		<xs:complexType>
			<xs:sequence>
				<xs:element minOccurs="3" maxOccurs="unbounded" ref="referencia" />
			</xs:sequence>
		</xs:complexType>
	</xs:element>
	<xs:element name="referencia">
		<xs:complexType>
			<xs:simpleContent>
				<xs:extension base="xs:string">
					<xs:attribute name="link" type="xs:string" use="required" />
				</xs:extension>
			</xs:simpleContent>
		</xs:complexType>
	</xs:element>
	<xs:element name="imagenes">
		<xs:complexType>
			<xs:sequence>
				<xs:element minOccurs="1" maxOccurs="5" ref="imagen" />
			</xs:sequence>
		</xs:complexType>
	</xs:element>
	<xs:element name="imagen">
		<xs:complexType>
			<xs:simpleContent>
				<xs:extension base="xs:string">
					<xs:attribute name="link" type="xs:string" use="required" />
				</xs:extension>
			</xs:simpleContent>
		</xs:complexType>
	</xs:element>
	<xs:element name="videos">
		<xs:complexType>
			<xs:sequence>
				<xs:element minOccurs="0" maxOccurs="3" ref="video" />
			</xs:sequence>
		</xs:complexType>
	</xs:element>
	<xs:element name="video">
		<xs:complexType>
			<xs:simpleContent>
				<xs:extension base="xs:string">
					<xs:attribute name="link" type="xs:string" use="required" />
				</xs:extension>
			</xs:simpleContent>
		</xs:complexType>
	</xs:element>
	<xs:element name="coordenadas">
		<xs:complexType>
			<xs:sequence>
				<xs:element minOccurs="1" maxOccurs="1" ref="coordenada" />
			</xs:sequence>
		</xs:complexType>
	</xs:element>
	<xs:element name="coordenada">
		<xs:complexType>
			<xs:simpleContent>
				<xs:extension base="xs:string">
					<xs:attribute name="longitud" use="required" >
						<xs:simpleType>
							<xs:restriction base="xs:float">
								<xs:minInclusive value="-180.0"/>
								<xs:maxInclusive value="180.0"/>
							</xs:restriction>
						</xs:simpleType>
					</xs:attribute>
					<xs:attribute name="latitud"  use="required" >
						<xs:simpleType>
							<xs:restriction base="xs:float">
								<xs:minInclusive value="-90.0"/>
								<xs:maxInclusive value="90.0"/>
							</xs:restriction>
						</xs:simpleType>
					</xs:attribute>
					<xs:attribute name="altitud"  use="required" >
						<xs:simpleType>
							<xs:restriction base="xs:float">
								<xs:minExclusive value="0.0"/>
							</xs:restriction>
						</xs:simpleType>
					</xs:attribute>
				</xs:extension>
			</xs:simpleContent>
		</xs:complexType>
	</xs:element>
	<xs:element name="tramos">
		<xs:complexType>
			<xs:sequence>
				<xs:element minOccurs="1" maxOccurs="unbounded" ref="tramo" />
			</xs:sequence>
		</xs:complexType>
	</xs:element>
	<xs:element name="tramo">
		<xs:complexType>
			<xs:simpleContent>
				<xs:extension base="xs:string">
					<xs:attribute name="distancia" use="required" >
						<xs:simpleType>
							<xs:restriction base="xs:float">
								<xs:minExclusive value="0.0"/>
							</xs:restriction>
						</xs:simpleType>
					</xs:attribute>
					<xs:attribute name="longitud" use="required" >
						<xs:simpleType>
							<xs:restriction base="xs:float">
								<xs:minInclusive value="-180.0"/>
								<xs:maxInclusive value="180.0"/>
							</xs:restriction>
						</xs:simpleType>
					</xs:attribute>
					<xs:attribute name="latitud"  use="required" >
						<xs:simpleType>
							<xs:restriction base="xs:float">
								<xs:minInclusive value="-90.0"/>
								<xs:maxInclusive value="90.0"/>
							</xs:restriction>
						</xs:simpleType>
					</xs:attribute>
					<xs:attribute name="altitud"  use="required" >
						<xs:simpleType>
							<xs:restriction base="xs:float">
								<xs:minExclusive value="0.0"/>
							</xs:restriction>
						</xs:simpleType>
					</xs:attribute>
					<xs:attribute name="numeroSector" use="required" >
						<xs:simpleType>
							<xs:restriction base="xs:integer">
								<xs:enumeration value="1" />
            					<xs:enumeration value="2" />
            					<xs:enumeration value="3" />
							</xs:restriction>
						</xs:simpleType>
					</xs:attribute>
				</xs:extension>
			</xs:simpleContent>
		</xs:complexType>
	</xs:element>
</xs:schema>